Invoice,StockCode,Description,Quantity,InvoiceDate,Price,Customer ID,Country
536531,22193,RED DINER WALL CLOCK,4,12/1/10 13:23,8.5,15485,United Kingdom
536531,22191,IVORY DINER WALL CLOCK,4,12/1/10 13:23,8.5,15485,United Kingdom
536531,22688,DOORMAT PEACE ON EARTH BLUE,4,12/1/10 13:23,7.95,15485,United Kingdom
536531,22768,FAMILY PHOTO FRAME CORNICE,6,12/1/10 13:23,9.95,15485,United Kingdom
536532,84692,BOX OF 24 COCKTAIL PARASOLS,50,12/1/10 13:24,0.42,12433,Norway
536532,22444,GROW YOUR OWN PLANT IN A CAN ,96,12/1/10 13:24,1.06,12433,Norway
536532,22899,CHILDREN'S APRON DOLLY GIRL ,8,12/1/10 13:24,2.1,12433,Norway
536532,21156,RETROSPOT CHILDRENS APRON,8,12/1/10 13:24,1.95,12433,Norway
536532,22556,PLASTERS IN TIN CIRCUS PARADE ,24,12/1/10 13:24,1.65,12433,Norway
536532,22555,PLASTERS IN TIN STRONGMAN,36,12/1/10 13:24,1.65,12433,Norway
536532,22554,PLASTERS IN TIN WOODLAND ANIMALS,24,12/1/10 13:24,1.65,12433,Norway
536532,22553,PLASTERS IN TIN SKULLS,24,12/1/10 13:24,1.65,12433,Norway
536532,22551,PLASTERS IN TIN SPACEBOY,24,12/1/10 13:24,1.65,12433,Norway
536532,22547,MINI JIGSAW DINOSAUR ,24,12/1/10 13:24,0.42,12433,Norway
536532,22544,MINI JIGSAW SPACEBOY,24,12/1/10 13:24,0.42,12433,Norway
536532,22543,MINI JIGSAW BAKE A CAKE ,24,12/1/10 13:24,0.42,12433,Norway
536532,22540,MINI JIGSAW CIRCUS PARADE ,24,12/1/10 13:24,0.42,12433,Norway
536532,22539,MINI JIGSAW DOLLY GIRL,24,12/1/10 13:24,0.42,12433,Norway
536532,22534,MAGIC DRAWING SLATE SPACEBOY ,24,12/1/10 13:24,0.42,12433,Norway
536532,22530,MAGIC DRAWING SLATE DOLLY GIRL ,24,12/1/10 13:24,0.42,12433,Norway
536532,22531,MAGIC DRAWING SLATE CIRCUS PARADE  ,24,12/1/10 13:24,0.42,12433,Norway
536532,22561,WOODEN SCHOOL COLOURING SET,24,12/1/10 13:24,1.65,12433,Norway
536532,22489,PACK OF 12 TRADITIONAL CRAYONS,24,12/1/10 13:24,0.42,12433,Norway
536532,22814,CARD PARTY GAMES ,12,12/1/10 13:24,0.42,12433,Norway
536532,21520,BOOZE & WOMEN GREETING CARD ,12,12/1/10 13:24,0.42,12433,Norway
536532,21506,"FANCY FONT BIRTHDAY CARD, ",12,12/1/10 13:24,0.42,12433,Norway
536532,22716,CARD CIRCUS PARADE,12,12/1/10 13:24,0.42,12433,Norway
536532,22866,HAND WARMER SCOTTY DOG DESIGN,12,12/1/10 13:24,2.1,12433,Norway
536532,22632,HAND WARMER RED RETROSPOT,12,12/1/10 13:24,2.1,12433,Norway
536532,22865,HAND WARMER OWL DESIGN,12,12/1/10 13:24,2.1,12433,Norway
536532,22114,HOT WATER BOTTLE TEA AND SYMPATHY,8,12/1/10 13:24,3.95,12433,Norway
536532,21982,PACK OF 12 SUKI TISSUES ,48,12/1/10 13:24,0.29,12433,Norway
536532,21981,PACK OF 12 WOODLAND TISSUES ,48,12/1/10 13:24,0.29,12433,Norway
536532,21967,PACK OF 12 SKULL TISSUES,48,12/1/10 13:24,0.29,12433,Norway
536532,22092,BLUE PAISLEY TISSUE BOX,12,12/1/10 13:24,1.25,12433,Norway
536532,21983,PACK OF 12 BLUE PAISLEY TISSUES ,48,12/1/10 13:24,0.29,12433,Norway
536532,22615,PACK OF 12 CIRCUS PARADE TISSUES ,48,12/1/10 13:24,0.29,12433,Norway
536532,21980,PACK OF 12 RED RETROSPOT TISSUES ,48,12/1/10 13:24,0.29,12433,Norway
536532,22614,PACK OF 12 SPACEBOY TISSUES,48,12/1/10 13:24,0.29,12433,Norway
536532,22095,LADS ONLY TISSUE BOX,12,12/1/10 13:24,1.25,12433,Norway
536532,22094,RED RETROSPOT TISSUE BOX,12,12/1/10 13:24,1.25,12433,Norway
536532,21984,PACK OF 12 PINK PAISLEY TISSUES ,48,12/1/10 13:24,0.29,12433,Norway
536532,22557,PLASTERS IN TIN VINTAGE PAISLEY ,36,12/1/10 13:24,1.65,12433,Norway
536532,21786,POLKADOT RAIN HAT ,24,12/1/10 13:24,0.42,12433,Norway
536532,21080,SET/20 RED RETROSPOT PAPER NAPKINS ,36,12/1/10 13:24,0.85,12433,Norway
536532,22963,JAM JAR WITH GREEN LID,12,12/1/10 13:24,0.85,12433,Norway
536532,22962,JAM JAR WITH PINK LID,12,12/1/10 13:24,0.85,12433,Norway
536532,22961,JAM MAKING SET PRINTED,24,12/1/10 13:24,1.45,12433,Norway
536532,84375,SET OF 20 KIDS COOKIE CUTTERS,24,12/1/10 13:24,2.1,12433,Norway
536532,22966,GINGERBREAD MAN COOKIE CUTTER,24,12/1/10 13:24,1.25,12433,Norway
536532,21874,GIN AND TONIC MUG,24,12/1/10 13:24,1.25,12433,Norway
536532,21873,IF YOU CAN'T STAND THE HEAT MUG,24,12/1/10 13:24,1.25,12433,Norway
536532,21870,I CAN ONLY PLEASE ONE PERSON MUG,24,12/1/10 13:24,1.25,12433,Norway
536532,22956,36 FOIL HEART CAKE CASES,12,12/1/10 13:24,2.1,12433,Norway
536532,84050,PINK HEART SHAPE EGG FRYING PAN,72,12/1/10 13:24,1.25,12433,Norway
536532,84991,60 TEATIME FAIRY CAKE CASES,24,12/1/10 13:24,0.55,12433,Norway
536532,84992,72 SWEETHEART FAIRY CAKE CASES,24,12/1/10 13:24,0.55,12433,Norway
536532,21213,PACK OF 72 SKULL CAKE CASES,24,12/1/10 13:24,0.55,12433,Norway
536532,21977,PACK OF 60 PINK PAISLEY CAKE CASES,24,12/1/10 13:24,0.55,12433,Norway
536532,21212,PACK OF 72 RETROSPOT CAKE CASES,24,12/1/10 13:24,0.55,12433,Norway
536532,22198,LARGE POPCORN HOLDER ,48,12/1/10 13:24,1.65,12433,Norway
536532,22197,SMALL POPCORN HOLDER,72,12/1/10 13:24,0.85,12433,Norway
536532,22315,200 RED + WHITE BENDY STRAWS,12,12/1/10 13:24,1.25,12433,Norway
536532,22667,RECIPE BOX RETROSPOT ,12,12/1/10 13:24,2.95,12433,Norway
536532,22666,RECIPE BOX PANTRY YELLOW DESIGN,12,12/1/10 13:24,2.95,12433,Norway
536532,22665,RECIPE BOX BLUE SKETCHBOOK DESIGN,12,12/1/10 13:24,2.95,12433,Norway
536532,22558,CLOTHES PEGS RETROSPOT PACK 24 ,24,12/1/10 13:24,1.49,12433,Norway
536532,22567,20 DOLLY PEGS RETROSPOT,24,12/1/10 13:24,1.25,12433,Norway
536532,85150,LADIES & GENTLEMEN METAL SIGN,12,12/1/10 13:24,2.55,12433,Norway
536532,21166,COOK WITH WINE METAL SIGN ,12,12/1/10 13:24,1.95,12433,Norway
536532,85152,HAND OVER THE CHOCOLATE   SIGN ,24,12/1/10 13:24,2.1,12433,Norway
536532,82600,NO SINGING METAL SIGN,24,12/1/10 13:24,2.1,12433,Norway
536532,21733,RED HANGING HEART T-LIGHT HOLDER,6,12/1/10 13:24,2.95,12433,Norway
536532,20685,DOORMAT RED RETROSPOT,2,12/1/10 13:24,7.95,12433,Norway
536532,22842,BISCUIT TIN VINTAGE RED,6,12/1/10 13:24,6.75,12433,Norway
536532,22494,EMERGENCY FIRST AID TIN ,24,12/1/10 13:24,1.25,12433,Norway
536532,21260,FIRST AID TIN,12,12/1/10 13:24,3.25,12433,Norway
536533,20754,RETROSPOT RED WASHING UP GLOVES,6,12/1/10 13:31,2.1,16955,United Kingdom
536533,22740,POLKADOT PEN,48,12/1/10 13:31,0.85,16955,United Kingdom
536533,22825,DECORATIVE PLANT POT WITH FRIEZE,2,12/1/10 13:31,7.95,16955,United Kingdom
536533,22680,FRENCH BLUE METAL DOOR SIGN 5,20,12/1/10 13:31,1.25,16955,United Kingdom
536533,22797,CHEST OF DRAWERS GINGHAM HEART ,3,12/1/10 13:31,16.95,16955,United Kingdom
536533,21843,RED RETROSPOT CAKE STAND,1,12/1/10 13:31,10.95,16955,United Kingdom
536534,22866,HAND WARMER SCOTTY DOG DESIGN,12,12/1/10 13:33,2.1,15350,United Kingdom
536534,22834,HAND WARMER BABUSHKA DESIGN,12,12/1/10 13:33,2.1,15350,United Kingdom
536534,22865,HAND WARMER OWL DESIGN,12,12/1/10 13:33,2.1,15350,United Kingdom
536534,22867,HAND WARMER BIRD DESIGN,12,12/1/10 13:33,2.1,15350,United Kingdom
536534,22112,CHOCOLATE HOT WATER BOTTLE,3,12/1/10 13:33,4.95,15350,United Kingdom
536535,22943,CHRISTMAS LIGHTS 10 VINTAGE BAUBLES,3,12/1/10 13:38,4.95,15605,United Kingdom
536535,22118,JOY WOODEN BLOCK LETTERS,3,12/1/10 13:38,4.95,15605,United Kingdom
536535,22121,NOEL WOODEN BLOCK LETTERS ,3,12/1/10 13:38,5.95,15605,United Kingdom
536535,22119,PEACE WOODEN BLOCK LETTERS,3,12/1/10 13:38,6.95,15605,United Kingdom
536535,21485,RETROSPOT HEART HOT WATER BOTTLE,3,12/1/10 13:38,4.95,15605,United Kingdom
536535,22219,LOVEBIRD HANGING DECORATION WHITE ,12,12/1/10 13:38,0.85,15605,United Kingdom
536535,21523,DOORMAT FANCY FONT HOME SWEET HOME,2,12/1/10 13:38,7.95,15605,United Kingdom
536535,48194,DOORMAT HEARTS,2,12/1/10 13:38,7.95,15605,United Kingdom
536535,20685,DOORMAT RED RETROSPOT,2,12/1/10 13:38,7.95,15605,United Kingdom
536535,21156,RETROSPOT CHILDRENS APRON,8,12/1/10 13:38,1.95,15605,United Kingdom
536535,22418,10 COLOUR SPACEBOY PEN,24,12/1/10 13:38,0.85,15605,United Kingdom
536535,22311,OFFICE MUG WARMER BLACK+SILVER ,6,12/1/10 13:38,2.95,15605,United Kingdom
536536,21485,RETROSPOT HEART HOT WATER BOTTLE,3,12/1/10 13:45,4.95,18144,United Kingdom
536536,84879,ASSORTED COLOUR BIRD ORNAMENT,80,12/1/10 13:45,1.69,18144,United Kingdom
536536,72817,SET OF 2 CHRISTMAS DECOUPAGE CANDLE,12,12/1/10 13:45,1.25,18144,United Kingdom
536537,22277,COSMETIC BAG VINTAGE ROSE PAISLEY,36,12/1/10 13:51,2.1,15922,United Kingdom
536537,22333,RETROSPOT PARTY BAG + STICKER SET,8,12/1/10 13:51,1.65,15922,United Kingdom
536537,20867,PINK ROSE FABRIC MIRROR,36,12/1/10 13:51,1.25,15922,United Kingdom
536537,21688,SILVER PLATE CANDLE BOWL SMALL,12,12/1/10 13:51,2.95,15922,United Kingdom
536537,21694,SMALL REGAL  SILVER CANDLEPOT ,12,12/1/10 13:51,2.95,15922,United Kingdom
536537,22183,CAKE STAND VICTORIAN FILIGREE MED,6,12/1/10 13:51,6.75,15922,United Kingdom
536537,22423,REGENCY CAKESTAND 3 TIER,2,12/1/10 13:51,12.75,15922,United Kingdom
536537,22798,ANTIQUE GLASS DRESSING TABLE POT,8,12/1/10 13:51,2.95,15922,United Kingdom
536537,22800,ANTIQUE TALL SWIRLGLASS TRINKET POT,8,12/1/10 13:51,3.75,15922,United Kingdom
536537,22801,ANTIQUE GLASS PEDESTAL BOWL,8,12/1/10 13:51,3.75,15922,United Kingdom
536537,22781,GUMBALL MAGAZINE RACK,2,12/1/10 13:51,7.65,15922,United Kingdom
536538,21466,RED FLOWER CROCHET FOOD COVER,1,12/1/10 13:54,3.75,14594,United Kingdom
536538,21467,CHERRY CROCHET FOOD COVER,1,12/1/10 13:54,3.75,14594,United Kingdom
536538,21471,STRAWBERRY RAFFIA FOOD COVER,1,12/1/10 13:54,3.75,14594,United Kingdom
536538,21469,POLKA DOT RAFFIA FOOD COVER,1,12/1/10 13:54,3.75,14594,United Kingdom
536538,21523,DOORMAT FANCY FONT HOME SWEET HOME,1,12/1/10 13:54,7.95,14594,United Kingdom
536538,48129,DOORMAT TOPIARY,1,12/1/10 13:54,7.95,14594,United Kingdom
536538,21524,DOORMAT SPOTTY HOME SWEET HOME,1,12/1/10 13:54,7.95,14594,United Kingdom
536538,22791,T-LIGHT GLASS FLUTED ANTIQUE,12,12/1/10 13:54,1.25,14594,United Kingdom
536538,84949,SILVER HANGING T-LIGHT HOLDER,6,12/1/10 13:54,1.65,14594,United Kingdom
536538,22086,PAPER CHAIN KIT 50'S CHRISTMAS ,5,12/1/10 13:54,2.95,14594,United Kingdom
536538,22910,PAPER CHAIN KIT VINTAGE CHRISTMAS,5,12/1/10 13:54,2.95,14594,United Kingdom
536538,22457,NATURAL SLATE HEART CHALKBOARD ,2,12/1/10 13:54,2.95,14594,United Kingdom
536538,21690,SILVER  CANDLEPOT JARDIN ,4,12/1/10 13:54,3.75,14594,United Kingdom
536538,22752,SET 7 BABUSHKA NESTING BOXES,2,12/1/10 13:54,8.5,14594,United Kingdom
536538,37343,POLKADOT MUG PINK ,6,12/1/10 13:54,1.65,14594,United Kingdom
536538,22088,PAPER BUNTING COLOURED LACE,1,12/1/10 13:54,2.95,14594,United Kingdom
536538,22195,LARGE HEART MEASURING SPOONS,5,12/1/10 13:54,1.65,14594,United Kingdom
536538,22470,HEART OF WICKER LARGE,2,12/1/10 13:54,2.95,14594,United Kingdom
536538,22469,HEART OF WICKER SMALL,8,12/1/10 13:54,1.65,14594,United Kingdom
536538,22173,METAL 4 HOOK HANGER FRENCH CHATEAU,2,12/1/10 13:54,2.95,14594,United Kingdom
536538,22584,PACK OF 6 PANNETONE GIFT BOXES,2,12/1/10 13:54,2.55,14594,United Kingdom
536538,22583,PACK OF 6 HANDBAG GIFT BOXES,2,12/1/10 13:54,2.55,14594,United Kingdom
536538,21143,ANTIQUE GLASS HEART DECORATION ,3,12/1/10 13:54,1.95,14594,United Kingdom
536538,84944,SET OF 6 KASHMIR FOLKART BAUBLES,2,12/1/10 13:54,4.25,14594,United Kingdom
536538,22601,CHRISTMAS RETROSPOT ANGEL WOOD,10,12/1/10 13:54,0.85,14594,United Kingdom
536538,22603,CHRISTMAS RETROSPOT TREE WOOD,10,12/1/10 13:54,0.85,14594,United Kingdom
536538,22600,CHRISTMAS RETROSPOT STAR WOOD,10,12/1/10 13:54,0.85,14594,United Kingdom
536538,22574,HEART WOODEN CHRISTMAS DECORATION,10,12/1/10 13:54,0.85,14594,United Kingdom
536538,22573,STAR WOODEN CHRISTMAS DECORATION,10,12/1/10 13:54,0.85,14594,United Kingdom
536538,85199L,LARGE HANGING IVORY & RED WOOD BIRD,10,12/1/10 13:54,0.65,14594,United Kingdom
536538,85199S,SMALL HANGING IVORY/RED WOOD BIRD,10,12/1/10 13:54,0.42,14594,United Kingdom
536539,22969,HOMEMADE JAM SCENTED CANDLES,12,12/1/10 14:03,1.45,15165,United Kingdom
536539,72741,GRAND CHOCOLATECANDLE,18,12/1/10 14:03,1.45,15165,United Kingdom
536539,37495,FAIRY CAKE BIRTHDAY CANDLE SET,4,12/1/10 14:03,3.75,15165,United Kingdom
536539,22807,SET OF 6 T-LIGHTS TOADSTOOLS,6,12/1/10 14:03,2.95,15165,United Kingdom
536539,22171,3 HOOK PHOTO SHELF ANTIQUE WHITE,2,12/1/10 14:03,8.5,15165,United Kingdom
536539,82486,WOOD S/3 CABINET ANT WHITE FINISH,2,12/1/10 14:03,7.95,15165,United Kingdom
536539,22173,METAL 4 HOOK HANGER FRENCH CHATEAU,8,12/1/10 14:03,2.95,15165,United Kingdom
536539,85067,CREAM SWEETHEART WALL CABINET,1,12/1/10 14:03,18.95,15165,United Kingdom
536539,48184,DOORMAT ENGLISH ROSE ,2,12/1/10 14:03,7.95,15165,United Kingdom
536539,48138,DOORMAT UNION FLAG,2,12/1/10 14:03,7.95,15165,United Kingdom
536539,48129,DOORMAT TOPIARY,2,12/1/10 14:03,7.95,15165,United Kingdom
536539,21625,VINTAGE UNION JACK APRON,3,12/1/10 14:03,6.95,15165,United Kingdom
536539,22326,ROUND SNACK BOXES SET OF4 WOODLAND ,6,12/1/10 14:03,2.95,15165,United Kingdom
536539,22423,REGENCY CAKESTAND 3 TIER,2,12/1/10 14:03,12.75,15165,United Kingdom
536539,21743,STAR PORTABLE TABLE LIGHT ,6,12/1/10 14:03,2.95,15165,United Kingdom
536539,22557,PLASTERS IN TIN VINTAGE PAISLEY ,12,12/1/10 14:03,1.65,15165,United Kingdom
536539,22554,PLASTERS IN TIN WOODLAND ANIMALS,12,12/1/10 14:03,1.65,15165,United Kingdom
536539,85019A,ROMANTIC IMAGES NOTEBOOK SET,4,12/1/10 14:03,4.25,15165,United Kingdom
536539,85019C,CURIOUS  IMAGES NOTEBOOK SET,3,12/1/10 14:03,4.25,15165,United Kingdom
536539,20902,VINTAGE KEEPSAKE BOX PARIS DAYS,2,12/1/10 14:03,6.35,15165,United Kingdom
536539,21429,RED GINGHAM ROSE JEWELLERY BOX,8,12/1/10 14:03,1.65,15165,United Kingdom
536539,22867,HAND WARMER BIRD DESIGN,12,12/1/10 14:03,2.1,15165,United Kingdom
536539,22632,HAND WARMER RED RETROSPOT,12,12/1/10 14:03,2.1,15165,United Kingdom
536539,84030E,ENGLISH ROSE HOT WATER BOTTLE,4,12/1/10 14:03,4.25,15165,United Kingdom
536539,22114,HOT WATER BOTTLE TEA AND SYMPATHY,4,12/1/10 14:03,3.95,15165,United Kingdom
536539,21481,FAWN BLUE HOT WATER BOTTLE,6,12/1/10 14:03,2.95,15165,United Kingdom
536539,22379,RECYCLING BAG RETROSPOT ,5,12/1/10 14:03,2.1,15165,United Kingdom
536540,22968,ROSE COTTAGE KEEPSAKE BOX ,4,12/1/10 14:05,9.95,14911,EIRE
536540,85071A,BLUE CHARLIE+LOLA PERSONAL DOORSIGN,6,12/1/10 14:05,2.95,14911,EIRE
536540,85071C,"CHARLIE+LOLA""EXTREMELY BUSY"" SIGN",6,12/1/10 14:05,2.55,14911,EIRE
536540,22355,CHARLOTTE BAG SUKI DESIGN,50,12/1/10 14:05,0.85,14911,EIRE
536540,21579,LOLITA  DESIGN  COTTON TOTE BAG,6,12/1/10 14:05,2.25,14911,EIRE
536540,21576,LETS GO SHOPPING COTTON TOTE BAG,6,12/1/10 14:05,2.25,14911,EIRE
536540,22147,FELTCRAFT BUTTERFLY HEARTS,12,12/1/10 14:05,1.45,14911,EIRE
536540,22150,3 STRIPEY MICE FELTCRAFT,12,12/1/10 14:05,1.95,14911,EIRE
536540,22492,MINI PAINT SET VINTAGE ,36,12/1/10 14:05,0.65,14911,EIRE
536540,22493,PAINT YOUR OWN CANVAS SET,24,12/1/10 14:05,1.65,14911,EIRE
536540,21833,CAMOUFLAGE LED TORCH,12,12/1/10 14:05,1.69,14911,EIRE
536540,85135B,BLUE DRAGONFLY HELICOPTER,2,12/1/10 14:05,7.95,14911,EIRE
536540,85136A,YELLOW SHARK HELICOPTER,2,12/1/10 14:05,7.95,14911,EIRE
536540,85136C,RED SHARK HELICOPTER,2,12/1/10 14:05,7.95,14911,EIRE
536540,21055,TOOL BOX SOFT TOY ,4,12/1/10 14:05,8.95,14911,EIRE
536540,21056,DOCTOR'S BAG SOFT TOY,4,12/1/10 14:05,8.95,14911,EIRE
536540,21889,WOODEN BOX OF DOMINOES,24,12/1/10 14:05,1.25,14911,EIRE
536540,21891,TRADITIONAL WOODEN SKIPPING ROPE,12,12/1/10 14:05,1.25,14911,EIRE
536540,22622,BOX OF VINTAGE ALPHABET BLOCKS,6,12/1/10 14:05,9.95,14911,EIRE
536540,C2,CARRIAGE,1,12/1/10 14:05,50,14911,EIRE
536541,21915,RED  HARMONICA IN BOX ,12,12/1/10 14:05,1.25,14911,EIRE
536542,22382,LUNCH BAG SPACEBOY DESIGN ,10,12/1/10 14:11,1.65,16456,United Kingdom
536542,20727,LUNCH BAG  BLACK SKULL.,10,12/1/10 14:11,1.65,16456,United Kingdom
536542,22383,LUNCH BAG SUKI  DESIGN ,20,12/1/10 14:11,1.65,16456,United Kingdom
536542,22386,JUMBO BAG PINK POLKADOT,30,12/1/10 14:11,1.95,16456,United Kingdom
536542,85099B,JUMBO BAG RED RETROSPOT,40,12/1/10 14:11,1.95,16456,United Kingdom
536542,22379,RECYCLING BAG RETROSPOT ,20,12/1/10 14:11,2.1,16456,United Kingdom
536542,20712,JUMBO BAG WOODLAND ANIMALS,20,12/1/10 14:11,1.95,16456,United Kingdom
536542,85099F,JUMBO BAG STRAWBERRY,30,12/1/10 14:11,1.95,16456,United Kingdom
536542,85099C,JUMBO  BAG BAROQUE BLACK WHITE,20,12/1/10 14:11,1.95,16456,United Kingdom
536542,21930,JUMBO STORAGE BAG SKULLS,20,12/1/10 14:11,1.95,16456,United Kingdom
536542,21928,JUMBO BAG SCANDINAVIAN PAISLEY,20,12/1/10 14:11,1.95,16456,United Kingdom
536542,22411,JUMBO SHOPPER VINTAGE RED PAISLEY,30,12/1/10 14:11,1.95,16456,United Kingdom
536542,21931,JUMBO STORAGE BAG SUKI,40,12/1/10 14:11,1.95,16456,United Kingdom
536542,20711,JUMBO BAG TOYS ,20,12/1/10 14:11,1.95,16456,United Kingdom
536542,20713,JUMBO BAG OWLS,30,12/1/10 14:11,1.95,16456,United Kingdom
536542,85123A,WHITE HANGING HEART T-LIGHT HOLDER,32,12/1/10 14:11,2.95,16456,United Kingdom
C536543,22632,HAND WARMER RED RETROSPOT,-1,12/1/10 14:30,2.1,17841,United Kingdom
C536543,22355,CHARLOTTE BAG SUKI DESIGN,-2,12/1/10 14:30,0.85,17841,United Kingdom
536544,21773,DECORATIVE ROSE BATHROOM BOTTLE,1,12/1/10 14:32,2.51,,United Kingdom
536544,21774,DECORATIVE CATS BATHROOM BOTTLE,2,12/1/10 14:32,2.51,,United Kingdom
536544,21786,POLKADOT RAIN HAT ,4,12/1/10 14:32,0.85,,United Kingdom
536544,21787,RAIN PONCHO RETROSPOT,2,12/1/10 14:32,1.66,,United Kingdom
536544,21790,VINTAGE SNAP CARDS,9,12/1/10 14:32,1.66,,United Kingdom
536544,21791,VINTAGE HEADS AND TAILS CARD GAME ,2,12/1/10 14:32,2.51,,United Kingdom
536544,21801,CHRISTMAS TREE DECORATION WITH BELL,10,12/1/10 14:32,0.43,,United Kingdom
536544,21802,CHRISTMAS TREE HEART DECORATION,9,12/1/10 14:32,0.43,,United Kingdom
536544,21803,CHRISTMAS TREE STAR DECORATION,11,12/1/10 14:32,0.43,,United Kingdom
536544,21809,CHRISTMAS HANGING TREE WITH BELL,1,12/1/10 14:32,2.51,,United Kingdom
536544,21810,CHRISTMAS HANGING STAR WITH BELL,3,12/1/10 14:32,2.51,,United Kingdom
536544,21811,CHRISTMAS HANGING HEART WITH BELL,1,12/1/10 14:32,2.51,,United Kingdom
536544,21821,GLITTER STAR GARLAND WITH BELLS ,1,12/1/10 14:32,7.62,,United Kingdom
536544,21822,GLITTER CHRISTMAS TREE WITH BELLS,1,12/1/10 14:32,4.21,,United Kingdom
536544,21823,PAINTED METAL HEART WITH HOLLY BELL,2,12/1/10 14:32,2.98,,United Kingdom
536544,21844,RED RETROSPOT MUG,2,12/1/10 14:32,5.91,,United Kingdom
536544,21851,LILAC DIAMANTE PEN IN GIFT BOX,1,12/1/10 14:32,4.21,,United Kingdom
536544,21870,I CAN ONLY PLEASE ONE PERSON MUG,1,12/1/10 14:32,3.36,,United Kingdom
536544,21871,SAVE THE PLANET MUG,5,12/1/10 14:32,3.36,,United Kingdom
536544,21874,GIN AND TONIC MUG,1,12/1/10 14:32,3.36,,United Kingdom
536544,21879,HEARTS GIFT TAPE,1,12/1/10 14:32,1.66,,United Kingdom
536544,21884,CAKES AND BOWS GIFT  TAPE,1,12/1/10 14:32,1.66,,United Kingdom
536544,21888,BINGO SET,1,12/1/10 14:32,7.62,,United Kingdom
536544,21889,WOODEN BOX OF DOMINOES,2,12/1/10 14:32,2.51,,United Kingdom
536544,21892,TRADITIONAL WOODEN CATCH CUP GAME ,3,12/1/10 14:32,2.51,,United Kingdom
536544,21894,POTTING SHED SEED ENVELOPES,1,12/1/10 14:32,2.51,,United Kingdom
536544,21911,GARDEN METAL SIGN ,1,12/1/10 14:32,3.36,,United Kingdom
536544,21912,VINTAGE SNAKES & LADDERS,3,12/1/10 14:32,7.62,,United Kingdom
536544,21913,VINTAGE SEASIDE JIGSAW PUZZLES,1,12/1/10 14:32,7.62,,United Kingdom
536544,21914,BLUE HARMONICA IN BOX ,3,12/1/10 14:32,2.51,,United Kingdom
536544,21915,RED  HARMONICA IN BOX ,2,12/1/10 14:32,2.51,,United Kingdom
536544,21922,UNION STRIPE WITH FRINGE  HAMMOCK,2,12/1/10 14:32,16.98,,United Kingdom
536544,21928,JUMBO BAG SCANDINAVIAN PAISLEY,1,12/1/10 14:32,4.21,,United Kingdom
536544,21935,SUKI  SHOULDER BAG,1,12/1/10 14:32,3.36,,United Kingdom
536544,21942,SKULLS DESIGN FLANNEL,2,12/1/10 14:32,1.66,,United Kingdom
536544,21944,KITTENS DESIGN FLANNEL,1,12/1/10 14:32,1.66,,United Kingdom
536544,21949,SET OF 6 STRAWBERRY CHOPSTICKS,1,12/1/10 14:32,2.51,,United Kingdom
536544,21975,PACK OF 60 DINOSAUR CAKE CASES,1,12/1/10 14:32,1.28,,United Kingdom
536544,21977,PACK OF 60 PINK PAISLEY CAKE CASES,1,12/1/10 14:32,1.28,,United Kingdom
536544,21982,PACK OF 12 SUKI TISSUES ,1,12/1/10 14:32,0.85,,United Kingdom
536544,21990,MODERN FLORAL STATIONERY SET,2,12/1/10 14:32,2.51,,United Kingdom
536544,21991,BOHEMIAN COLLAGE STATIONERY SET,1,12/1/10 14:32,2.51,,United Kingdom
536544,21992,VINTAGE PAISLEY STATIONERY SET,6,12/1/10 14:32,2.51,,United Kingdom
536544,21993,FLORAL FOLK STATIONERY SET,4,12/1/10 14:32,2.51,,United Kingdom
536544,22037,ROBOT BIRTHDAY CARD,1,12/1/10 14:32,0.85,,United Kingdom
536544,22043,CHRISTMAS CARD SCREEN PRINT ,1,12/1/10 14:32,0.43,,United Kingdom
536544,22064,PINK DOUGHNUT TRINKET POT ,1,12/1/10 14:32,3.36,,United Kingdom
536544,22065,CHRISTMAS PUDDING TRINKET POT ,1,12/1/10 14:32,3.36,,United Kingdom
536544,22067,CHOC TRUFFLE GOLD TRINKET POT ,1,12/1/10 14:32,3.36,,United Kingdom
536544,22068,BLACK PIRATE TREASURE CHEST,1,12/1/10 14:32,3.36,,United Kingdom
536544,22069,BROWN  PIRATE TREASURE CHEST ,1,12/1/10 14:32,3.36,,United Kingdom
536544,22071,SMALL WHITE RETROSPOT MUG IN BOX ,1,12/1/10 14:32,7.62,,United Kingdom
536544,22075,6 RIBBONS ELEGANT CHRISTMAS ,1,12/1/10 14:32,3.36,,United Kingdom
536544,22076,6 RIBBONS EMPIRE  ,1,12/1/10 14:32,3.36,,United Kingdom
536544,22077,6 RIBBONS RUSTIC CHARM,3,12/1/10 14:32,3.36,,United Kingdom
536544,22080,RIBBON REEL POLKADOTS ,1,12/1/10 14:32,3.36,,United Kingdom
536544,22081,RIBBON REEL FLORA + FAUNA ,1,12/1/10 14:32,3.36,,United Kingdom
536544,22082,RIBBON REEL STRIPES DESIGN ,1,12/1/10 14:32,3.36,,United Kingdom
536544,22083,PAPER CHAIN KIT RETROSPOT,4,12/1/10 14:32,5.91,,United Kingdom
536544,22086,PAPER CHAIN KIT 50'S CHRISTMAS ,33,12/1/10 14:32,5.91,,United Kingdom
536544,22087,PAPER BUNTING WHITE LACE,2,12/1/10 14:32,5.91,,United Kingdom
536544,22090,PAPER BUNTING RETROSPOT,1,12/1/10 14:32,5.91,,United Kingdom
536544,22095,LADS ONLY TISSUE BOX,2,12/1/10 14:32,2.51,,United Kingdom
536544,22100,SKULLS SQUARE TISSUE BOX,1,12/1/10 14:32,2.51,,United Kingdom
536544,22107,PIZZA PLATE IN BOX,1,12/1/10 14:32,7.62,,United Kingdom
536544,22110,BIRD HOUSE HOT WATER BOTTLE,2,12/1/10 14:32,7.62,,United Kingdom
536544,22111,SCOTTIE DOG HOT WATER BOTTLE,2,12/1/10 14:32,11.02,,United Kingdom
536545,21134,,1,12/1/10 14:32,0,,United Kingdom
536544,22112,CHOCOLATE HOT WATER BOTTLE,2,12/1/10 14:32,11.02,,United Kingdom
536544,22114,HOT WATER BOTTLE TEA AND SYMPATHY,3,12/1/10 14:32,8.47,,United Kingdom
536544,22115,METAL SIGN EMPIRE TEA,2,12/1/10 14:32,5.91,,United Kingdom
536544,22130,PARTY CONE CHRISTMAS DECORATION ,2,12/1/10 14:32,8.47,,United Kingdom
536544,22134,LADLE LOVE HEART RED ,1,12/1/10 14:32,0.85,,United Kingdom
536544,22135,LADLE LOVE HEART PINK,5,12/1/10 14:32,0.85,,United Kingdom
536544,22141,CHRISTMAS CRAFT TREE TOP ANGEL,4,12/1/10 14:32,4.21,,United Kingdom
536544,22144,CHRISTMAS CRAFT LITTLE FRIENDS,4,12/1/10 14:32,4.21,,United Kingdom
536544,22149,FELTCRAFT 6 FLOWER FRIENDS,1,12/1/10 14:32,4.21,,United Kingdom
536544,22153,ANGEL DECORATION STARS ON DRESS,1,12/1/10 14:32,0.85,,United Kingdom
536544,22154,ANGEL DECORATION 3 BUTTONS ,1,12/1/10 14:32,0.85,,United Kingdom
536544,22155,STAR DECORATION RUSTIC,3,12/1/10 14:32,0.85,,United Kingdom
536544,22156,HEART DECORATION WITH PEARLS ,3,12/1/10 14:32,1.66,,United Kingdom
536544,22161,HEART DECORATION RUSTIC HANGING ,10,12/1/10 14:32,0.81,,United Kingdom
536544,22162,HEART GARLAND RUSTIC PADDED,2,12/1/10 14:32,3.36,,United Kingdom
536544,22169,FAMILY ALBUM WHITE PICTURE FRAME,1,12/1/10 14:32,16.98,,United Kingdom
536544,22174,PHOTO CUBE,2,12/1/10 14:32,3.36,,United Kingdom
536544,22178,VICTORIAN GLASS HANGING T-LIGHT,13,12/1/10 14:32,2.51,,United Kingdom
536544,22182,CAKE STAND VICTORIAN FILIGREE SMALL,1,12/1/10 14:32,4.21,,United Kingdom
536544,22185,SLATE TILE NATURAL HANGING,1,12/1/10 14:32,3.36,,United Kingdom
536544,22189,CREAM HEART CARD HOLDER,1,12/1/10 14:32,8.47,,United Kingdom
536544,22190,LOCAL CAFE MUG,3,12/1/10 14:32,2.51,,United Kingdom
536544,22195,LARGE HEART MEASURING SPOONS,1,12/1/10 14:32,3.36,,United Kingdom
536544,22196,SMALL HEART MEASURING SPOONS,2,12/1/10 14:32,1.66,,United Kingdom
536544,22197,SMALL POPCORN HOLDER,2,12/1/10 14:32,1.66,,United Kingdom
536544,22198,LARGE POPCORN HOLDER ,4,12/1/10 14:32,3.36,,United Kingdom
536544,22203,MILK PAN RED RETROSPOT,1,12/1/10 14:32,7.62,,United Kingdom
536544,22207,FRYING PAN UNION FLAG,1,12/1/10 14:32,8.47,,United Kingdom
536544,22219,LOVEBIRD HANGING DECORATION WHITE ,3,12/1/10 14:32,1.66,,United Kingdom
536544,22224,WHITE LOVEBIRD LANTERN,1,12/1/10 14:32,5.91,,United Kingdom
536544,22265,EASTER DECORATION NATURAL CHICK,2,12/1/10 14:32,1.28,,United Kingdom
536544,22276,WASH BAG VINTAGE ROSE PAISLEY,1,12/1/10 14:32,5.91,,United Kingdom
536544,22294,HEART FILIGREE DOVE  SMALL,4,12/1/10 14:32,2.51,,United Kingdom
536544,22296,HEART IVORY TRELLIS LARGE,1,12/1/10 14:32,3.36,,United Kingdom
536544,22297,HEART IVORY TRELLIS SMALL,1,12/1/10 14:32,2.51,,United Kingdom
536544,22299,PIG KEYRING WITH LIGHT & SOUND ,1,12/1/10 14:32,2.51,,United Kingdom
536544,22300,COFFEE MUG DOG + BALL DESIGN,1,12/1/10 14:32,5.06,,United Kingdom
536544,22301,COFFEE MUG CAT + BIRD DESIGN,2,12/1/10 14:32,5.06,,United Kingdom
536544,22309,TEA COSY RED  STRIPE,1,12/1/10 14:32,5.06,,United Kingdom
536544,22310,IVORY KNITTED MUG COSY ,9,12/1/10 14:32,3.36,,United Kingdom
536544,22314,OFFICE MUG WARMER CHOC+BLUE,1,12/1/10 14:32,5.91,,United Kingdom
536544,22318,FIVE HEART HANGING DECORATION,1,12/1/10 14:32,5.91,,United Kingdom
536544,22335,HEART DECORATION PAINTED ZINC ,4,12/1/10 14:32,1.28,,United Kingdom
536544,22336,DOVE DECORATION PAINTED ZINC ,4,12/1/10 14:32,1.28,,United Kingdom
536544,22345,PARTY PIZZA DISH BLUE POLKADOT,1,12/1/10 14:32,1.66,,United Kingdom
536544,22348,TEA BAG PLATE RED RETROSPOT,3,12/1/10 14:32,1.66,,United Kingdom
