Invoice,StockCode,Description,Quantity,InvoiceDate,Price,Customer ID,Country
536592,20974,12 PENCILS SMALL TUBE SKULL,12,12/1/10 17:06,1.28,,United Kingdom
536592,20975,12 PENCILS SMALL TUBE RED RETROSPOT,18,12/1/10 17:06,1.28,,United Kingdom
536592,21002,ROSE DU SUD DRAWSTRING BAG,2,12/1/10 17:06,3.36,,United Kingdom
536592,21012,ANTIQUE ALL GLASS CANDLESTICK,6,12/1/10 17:06,2.51,,United Kingdom
536592,21015,DARK BIRD HOUSE TREE DECORATION,1,12/1/10 17:06,1.28,,United Kingdom
536592,21035,SET/2 RED RETROSPOT TEA TOWELS ,2,12/1/10 17:06,5.91,,United Kingdom
536592,21055,TOOL BOX SOFT TOY ,2,12/1/10 17:06,16.98,,United Kingdom
536592,21067,VINTAGE RED TEATIME MUG,1,12/1/10 17:06,2.51,,United Kingdom
536592,21069,VINTAGE BILLBOARD TEA MUG,1,12/1/10 17:06,2.51,,United Kingdom
536592,21071,VINTAGE BILLBOARD DRINK ME MUG,1,12/1/10 17:06,2.51,,United Kingdom
536592,21098,CHRISTMAS TOILET ROLL,22,12/1/10 17:06,2.51,,United Kingdom
536592,21108,FAIRY CAKE FLANNEL ASSORTED COLOUR,19,12/1/10 17:06,5.06,,United Kingdom
536592,21109,"LARGE CAKE TOWEL, CHOCOLATE SPOTS",1,12/1/10 17:06,13.57,,United Kingdom
536592,21110,LARGE CAKE TOWEL PINK SPOTS,2,12/1/10 17:06,13.57,,United Kingdom
536592,21111,"SWISS ROLL TOWEL, CHOCOLATE  SPOTS",2,12/1/10 17:06,5.91,,United Kingdom
536592,21128,GOLD FISHING GNOME,1,12/1/10 17:06,12.72,,United Kingdom
536592,21154,RED RETROSPOT OVEN GLOVE ,2,12/1/10 17:06,2.51,,United Kingdom
536592,21164,HOME SWEET HOME METAL SIGN ,1,12/1/10 17:06,5.91,,United Kingdom
536592,21165,BEWARE OF THE CAT METAL SIGN ,3,12/1/10 17:06,4.21,,United Kingdom
536592,21174,POTTERING IN THE SHED METAL SIGN,4,12/1/10 17:06,4.21,,United Kingdom
536592,21181,PLEASE ONE PERSON METAL SIGN,2,12/1/10 17:06,4.21,,United Kingdom
536592,21188,3D HEARTS  HONEYCOMB PAPER GARLAND,2,12/1/10 17:06,5.91,,United Kingdom
536592,21191,LARGE WHITE HONEYCOMB PAPER BELL  ,5,12/1/10 17:06,4.21,,United Kingdom
536592,21192,WHITE BELL HONEYCOMB PAPER ,2,12/1/10 17:06,3.36,,United Kingdom
536592,21208,PASTEL COLOUR HONEYCOMB FAN,1,12/1/10 17:06,3.36,,United Kingdom
536592,21212,PACK OF 72 RETROSPOT CAKE CASES,12,12/1/10 17:06,1.28,,United Kingdom
536592,21213,PACK OF 72 SKULL CAKE CASES,1,12/1/10 17:06,1.28,,United Kingdom
536592,21220,SET/4 BADGES DOGS,1,12/1/10 17:06,2.51,,United Kingdom
536592,21231,SWEETHEART CERAMIC TRINKET BOX,8,12/1/10 17:06,2.51,,United Kingdom
536592,21232,STRAWBERRY CERAMIC TRINKET BOX,5,12/1/10 17:06,2.51,,United Kingdom
536592,21249,WOODLAND  HEIGHT CHART STICKERS ,1,12/1/10 17:06,5.91,,United Kingdom
536592,21257,VICTORIAN SEWING BOX MEDIUM,2,12/1/10 17:06,16.13,,United Kingdom
536592,21258,VICTORIAN SEWING BOX LARGE,3,12/1/10 17:06,25.49,,United Kingdom
536592,21262,WHITE GOOSE FEATHER CHRISTMAS TREE ,1,12/1/10 17:06,7.62,,United Kingdom
536592,21272,SALLE DE BAIN HOOK,1,12/1/10 17:06,2.51,,United Kingdom
536592,21279,VINTAGE KITCHEN PRINT FRUITS,1,12/1/10 17:06,5.06,,United Kingdom
536592,21281,VINTAGE KITCHEN PRINT SEAFOOD,1,12/1/10 17:06,5.06,,United Kingdom
536592,21288,STRIPEY CHOCOLATE NESTING BOXES,1,12/1/10 17:06,5.91,,United Kingdom
536592,21313,GLASS HEART T-LIGHT HOLDER ,8,12/1/10 17:06,1.66,,United Kingdom
536592,21314,SMALL GLASS HEART TRINKET POT,8,12/1/10 17:06,4.21,,United Kingdom
536592,21340,CLASSIC METAL BIRDCAGE PLANT HOLDER,1,12/1/10 17:06,25.49,,United Kingdom
536592,21349,IVY HEART WREATH,3,12/1/10 17:06,13.57,,United Kingdom
536592,21352,EUCALYPTUS & PINECONE  WREATH,7,12/1/10 17:06,5.91,,United Kingdom
536592,21356,TOAST ITS - FAIRY FLOWER,1,12/1/10 17:06,2.51,,United Kingdom
536592,21429,RED GINGHAM ROSE JEWELLERY BOX,3,12/1/10 17:06,3.36,,United Kingdom
536592,21439,BASKET OF TOADSTOOLS,1,12/1/10 17:06,2.51,,United Kingdom
536592,21447,12 IVORY ROSE PEG PLACE SETTINGS,1,12/1/10 17:06,2.51,,United Kingdom
536592,21479,WHITE SKULL HOT WATER BOTTLE ,8,12/1/10 17:06,7.62,,United Kingdom
536592,21481,FAWN BLUE HOT WATER BOTTLE,3,12/1/10 17:06,5.91,,United Kingdom
536592,21484,CHICK GREY HOT WATER BOTTLE,2,12/1/10 17:06,7.62,,United Kingdom
536592,21486,PINK HEART DOTS HOT WATER BOTTLE,7,12/1/10 17:06,4.21,,United Kingdom
536592,21488,RED WHITE SCARF  HOT WATER BOTTLE,1,12/1/10 17:06,8.47,,United Kingdom
536592,21494,ROTATING LEAVES T-LIGHT HOLDER,2,12/1/10 17:06,5.06,,United Kingdom
536592,21519,GIN & TONIC DIET GREETING CARD ,1,12/1/10 17:06,0.85,,United Kingdom
536592,21520,BOOZE & WOMEN GREETING CARD ,1,12/1/10 17:06,0.85,,United Kingdom
536592,21524,DOORMAT SPOTTY HOME SWEET HOME,1,12/1/10 17:06,14.43,,United Kingdom
536592,21537,RED RETROSPOT PUDDING BOWL,2,12/1/10 17:06,8.47,,United Kingdom
536592,21544,SKULLS  WATER TRANSFER TATTOOS ,1,12/1/10 17:06,1.66,,United Kingdom
536592,21547,CERAMIC BIRDHOUSE CRESTED TIT SMALL,1,12/1/10 17:06,5.91,,United Kingdom
536592,21557,SET OF 6 FUNKY BEAKERS,1,12/1/10 17:06,5.91,,United Kingdom
536592,21559,STRAWBERRY LUNCH BOX WITH CUTLERY,1,12/1/10 17:06,5.06,,United Kingdom
536592,21576,LETS GO SHOPPING COTTON TOTE BAG,1,12/1/10 17:06,5.06,,United Kingdom
536592,21594,Dr. Jam's Arouzer Stress Ball,1,12/1/10 17:06,4.21,,United Kingdom
536592,21638,ASSORTED TUTTI FRUTTI NOTEBOOK,1,12/1/10 17:06,4.21,,United Kingdom
536592,21648,ASSORTED TUTTI FRUTTI SMALL PURSE,3,12/1/10 17:06,2.51,,United Kingdom
536592,21656,RIDGED GLASS POSY VASE ,1,12/1/10 17:06,3.36,,United Kingdom
536592,21658,GLASS  BEURRE DISH,1,12/1/10 17:06,8.47,,United Kingdom
536592,21671,RED SPOT CERAMIC DRAWER KNOB,2,12/1/10 17:06,2.51,,United Kingdom
536592,21684,SMALL MEDINA STAMPED METAL BOWL ,1,12/1/10 17:06,2.51,,United Kingdom
536592,21698,MOCK LOBSTER FRIDGE MAGNET,1,12/1/10 17:06,1.66,,United Kingdom
536592,21700,BIG DOUGHNUT FRIDGE MAGNETS,1,12/1/10 17:06,8.47,,United Kingdom
536592,21705,BAG 500g SWIRLY MARBLES,2,12/1/10 17:06,3.36,,United Kingdom
536592,21718,RED METAL BEACH SPADE ,1,12/1/10 17:06,2.51,,United Kingdom
536592,21731,RED TOADSTOOL LED NIGHT LIGHT,1,12/1/10 17:06,3.36,,United Kingdom
536592,21743,STAR PORTABLE TABLE LIGHT ,1,12/1/10 17:06,5.91,,United Kingdom
536592,21745,GAOLERS KEYS DECORATIVE GARDEN ,1,12/1/10 17:06,8.47,,United Kingdom
536592,21754,HOME BUILDING BLOCK WORD,1,12/1/10 17:06,11.87,,United Kingdom
536592,21755,LOVE BUILDING BLOCK WORD,1,12/1/10 17:06,11.87,,United Kingdom
536592,21756,BATH BUILDING BLOCK WORD,1,12/1/10 17:06,11.87,,United Kingdom
536592,21773,DECORATIVE ROSE BATHROOM BOTTLE,3,12/1/10 17:06,2.51,,United Kingdom
536592,21774,DECORATIVE CATS BATHROOM BOTTLE,5,12/1/10 17:06,2.51,,United Kingdom
536592,21775,DECORATIVE FLORE BATHROOM BOTTLE,3,12/1/10 17:06,2.51,,United Kingdom
536592,21777,RECIPE BOX WITH METAL HEART,2,12/1/10 17:06,7.95,,United Kingdom
536592,21786,POLKADOT RAIN HAT ,7,12/1/10 17:06,0.85,,United Kingdom
536592,21789,KIDS RAIN MAC PINK,2,12/1/10 17:06,1.66,,United Kingdom
536592,21790,VINTAGE SNAP CARDS,5,12/1/10 17:06,1.66,,United Kingdom
536592,21791,VINTAGE HEADS AND TAILS CARD GAME ,1,12/1/10 17:06,2.51,,United Kingdom
536592,21801,CHRISTMAS TREE DECORATION WITH BELL,10,12/1/10 17:06,0.43,,United Kingdom
536592,21802,CHRISTMAS TREE HEART DECORATION,17,12/1/10 17:06,0.43,,United Kingdom
536592,21803,CHRISTMAS TREE STAR DECORATION,12,12/1/10 17:06,0.43,,United Kingdom
536592,21809,CHRISTMAS HANGING TREE WITH BELL,1,12/1/10 17:06,2.51,,United Kingdom
536592,21813,GARLAND WITH STARS AND BELLS,1,12/1/10 17:06,10.17,,United Kingdom
536592,21820,GLITTER HEART GARLAND WITH BELLS ,1,12/1/10 17:06,7.62,,United Kingdom
536592,21821,GLITTER STAR GARLAND WITH BELLS ,1,12/1/10 17:06,7.62,,United Kingdom
536592,21830,ASSORTED CREEPY CRAWLIES,1,12/1/10 17:06,0.85,,United Kingdom
536592,21832,CHOCOLATE CALCULATOR,3,12/1/10 17:06,3.36,,United Kingdom
536592,21833,CAMOUFLAGE LED TORCH,2,12/1/10 17:06,3.36,,United Kingdom
536592,21844,RED RETROSPOT MUG,1,12/1/10 17:06,5.91,,United Kingdom
536592,21846,PINK DIAMANTE PEN IN GIFT BOX,4,12/1/10 17:06,4.21,,United Kingdom
536592,21851,LILAC DIAMANTE PEN IN GIFT BOX,3,12/1/10 17:06,4.21,,United Kingdom
536592,21868,POTTING SHED TEA MUG,2,12/1/10 17:06,3.36,,United Kingdom
536592,21871,SAVE THE PLANET MUG,3,12/1/10 17:06,3.36,,United Kingdom
536592,21875,KINGS CHOICE MUG,1,12/1/10 17:06,3.36,,United Kingdom
536592,21879,HEARTS GIFT TAPE,1,12/1/10 17:06,1.66,,United Kingdom
536592,21889,WOODEN BOX OF DOMINOES,2,12/1/10 17:06,2.51,,United Kingdom
536592,21891,TRADITIONAL WOODEN SKIPPING ROPE,4,12/1/10 17:06,2.51,,United Kingdom
536592,21892,TRADITIONAL WOODEN CATCH CUP GAME ,1,12/1/10 17:06,2.51,,United Kingdom
536592,21896,POTTING SHED TWINE,1,12/1/10 17:06,4.21,,United Kingdom
536592,21899,"KEY FOB , GARAGE DESIGN",1,12/1/10 17:06,1.66,,United Kingdom
536592,21906,PHARMACIE FIRST AID TIN,1,12/1/10 17:06,13.57,,United Kingdom
536592,21908,CHOCOLATE THIS WAY METAL SIGN,1,12/1/10 17:06,4.21,,United Kingdom
536592,21914,BLUE HARMONICA IN BOX ,2,12/1/10 17:06,2.51,,United Kingdom
536592,21915,RED  HARMONICA IN BOX ,3,12/1/10 17:06,2.51,,United Kingdom
536592,21929,JUMBO BAG PINK VINTAGE PAISLEY,1,12/1/10 17:06,4.21,,United Kingdom
536592,21931,JUMBO STORAGE BAG SUKI,1,12/1/10 17:06,4.21,,United Kingdom
536592,21934,SKULL SHOULDER BAG,1,12/1/10 17:06,3.36,,United Kingdom
536592,21935,SUKI  SHOULDER BAG,2,12/1/10 17:06,3.36,,United Kingdom
536592,21942,SKULLS DESIGN FLANNEL,2,12/1/10 17:06,1.66,,United Kingdom
536592,21949,SET OF 6 STRAWBERRY CHOPSTICKS,2,12/1/10 17:06,2.51,,United Kingdom
536592,21974,SET OF 36 PAISLEY FLOWER DOILIES,5,12/1/10 17:06,2.98,,United Kingdom
536592,21975,PACK OF 60 DINOSAUR CAKE CASES,11,12/1/10 17:06,1.28,,United Kingdom
536592,21976,PACK OF 60 MUSHROOM CAKE CASES,1,12/1/10 17:06,1.28,,United Kingdom
536592,21977,PACK OF 60 PINK PAISLEY CAKE CASES,21,12/1/10 17:06,1.28,,United Kingdom
536592,21981,PACK OF 12 WOODLAND TISSUES ,1,12/1/10 17:06,0.85,,United Kingdom
536592,21982,PACK OF 12 SUKI TISSUES ,2,12/1/10 17:06,0.85,,United Kingdom
536592,21984,PACK OF 12 PINK PAISLEY TISSUES ,1,12/1/10 17:06,0.85,,United Kingdom
536592,21985,PACK OF 12 HEARTS DESIGN TISSUES ,1,12/1/10 17:06,0.85,,United Kingdom
536592,21990,MODERN FLORAL STATIONERY SET,2,12/1/10 17:06,2.51,,United Kingdom
536592,21991,BOHEMIAN COLLAGE STATIONERY SET,2,12/1/10 17:06,2.51,,United Kingdom
536592,21992,VINTAGE PAISLEY STATIONERY SET,14,12/1/10 17:06,2.51,,United Kingdom
536592,21993,FLORAL FOLK STATIONERY SET,6,12/1/10 17:06,2.51,,United Kingdom
536592,22064,PINK DOUGHNUT TRINKET POT ,2,12/1/10 17:06,3.36,,United Kingdom
536592,22065,CHRISTMAS PUDDING TRINKET POT ,1,12/1/10 17:06,3.36,,United Kingdom
536592,22077,6 RIBBONS RUSTIC CHARM,7,12/1/10 17:06,3.36,,United Kingdom
536592,22078,RIBBON REEL LACE DESIGN ,1,12/1/10 17:06,4.21,,United Kingdom
536592,22081,RIBBON REEL FLORA + FAUNA ,2,12/1/10 17:06,3.36,,United Kingdom
536592,22082,RIBBON REEL STRIPES DESIGN ,6,12/1/10 17:06,3.36,,United Kingdom
536592,22083,PAPER CHAIN KIT RETROSPOT,2,12/1/10 17:06,5.91,,United Kingdom
536592,22084,PAPER CHAIN KIT EMPIRE,1,12/1/10 17:06,5.91,,United Kingdom
536592,22086,PAPER CHAIN KIT 50'S CHRISTMAS ,22,12/1/10 17:06,5.91,,United Kingdom
536592,22090,PAPER BUNTING RETROSPOT,1,12/1/10 17:06,5.91,,United Kingdom
536592,22091,EMPIRE TISSUE BOX,2,12/1/10 17:06,2.51,,United Kingdom
536592,22100,SKULLS SQUARE TISSUE BOX,1,12/1/10 17:06,2.51,,United Kingdom
536592,22109,FULL ENGLISH BREAKFAST PLATE,2,12/1/10 17:06,7.62,,United Kingdom
536592,22111,SCOTTIE DOG HOT WATER BOTTLE,3,12/1/10 17:06,11.02,,United Kingdom
536592,22112,CHOCOLATE HOT WATER BOTTLE,3,12/1/10 17:06,11.02,,United Kingdom
536592,22114,HOT WATER BOTTLE TEA AND SYMPATHY,3,12/1/10 17:06,8.47,,United Kingdom
536592,22117,METAL SIGN HER DINNER IS SERVED ,1,12/1/10 17:06,5.91,,United Kingdom
536592,22121,NOEL WOODEN BLOCK LETTERS ,1,12/1/10 17:06,11.87,,United Kingdom
536592,22124,SET OF 2 TEA TOWELS PING MICROWAVE,2,12/1/10 17:06,2.51,,United Kingdom
536592,22134,LADLE LOVE HEART RED ,4,12/1/10 17:06,0.85,,United Kingdom
536592,22135,LADLE LOVE HEART PINK,4,12/1/10 17:06,0.85,,United Kingdom
536592,22141,CHRISTMAS CRAFT TREE TOP ANGEL,4,12/1/10 17:06,4.21,,United Kingdom
536592,22142,CHRISTMAS CRAFT WHITE FAIRY ,1,12/1/10 17:06,3.36,,United Kingdom
536592,22144,CHRISTMAS CRAFT LITTLE FRIENDS,2,12/1/10 17:06,4.21,,United Kingdom
536592,22147,FELTCRAFT BUTTERFLY HEARTS,2,12/1/10 17:06,3.36,,United Kingdom
536592,22149,FELTCRAFT 6 FLOWER FRIENDS,2,12/1/10 17:06,4.21,,United Kingdom
536592,22161,HEART DECORATION RUSTIC HANGING ,7,12/1/10 17:06,0.81,,United Kingdom
536592,22162,HEART GARLAND RUSTIC PADDED,3,12/1/10 17:06,3.36,,United Kingdom
536592,22165,"DIAMANTE HEART SHAPED WALL MIRROR, ",1,12/1/10 17:06,11.02,,United Kingdom
536592,22169,FAMILY ALBUM WHITE PICTURE FRAME,1,12/1/10 17:06,16.98,,United Kingdom
536592,22174,PHOTO CUBE,5,12/1/10 17:06,3.36,,United Kingdom
536592,22178,VICTORIAN GLASS HANGING T-LIGHT,8,12/1/10 17:06,2.51,,United Kingdom
536592,22182,CAKE STAND VICTORIAN FILIGREE SMALL,1,12/1/10 17:06,4.21,,United Kingdom
536592,22183,CAKE STAND VICTORIAN FILIGREE MED,2,12/1/10 17:06,5.91,,United Kingdom
536592,22184,CAKE STAND VICTORIAN FILIGREE LARGE,1,12/1/10 17:06,8.47,,United Kingdom
536592,22188,BLACK HEART CARD HOLDER,2,12/1/10 17:06,8.47,,United Kingdom
536592,22190,LOCAL CAFE MUG,3,12/1/10 17:06,2.51,,United Kingdom
536592,22195,LARGE HEART MEASURING SPOONS,4,12/1/10 17:06,3.36,,United Kingdom
536592,22197,SMALL POPCORN HOLDER,34,12/1/10 17:06,1.66,,United Kingdom
536592,22198,LARGE POPCORN HOLDER ,2,12/1/10 17:06,3.36,,United Kingdom
536592,22207,FRYING PAN UNION FLAG,1,12/1/10 17:06,8.47,,United Kingdom
536592,22208,WOOD STAMP SET THANK YOU,1,12/1/10 17:06,3.36,,United Kingdom
536592,22245,"HOOK, 1 HANGER ,MAGIC GARDEN",2,12/1/10 17:06,1.66,,United Kingdom
536592,22246,MAGIC GARDEN FELT GARLAND ,2,12/1/10 17:06,4.21,,United Kingdom
536592,22260,FELT EGG COSY BLUE RABBIT ,2,12/1/10 17:06,1.66,,United Kingdom
536592,22261,FELT EGG COSY WHITE RABBIT ,2,12/1/10 17:06,1.66,,United Kingdom
536592,22262,FELT EGG COSY CHICKEN,3,12/1/10 17:06,1.66,,United Kingdom
536592,22276,WASH BAG VINTAGE ROSE PAISLEY,2,12/1/10 17:06,5.91,,United Kingdom
536592,22277,COSMETIC BAG VINTAGE ROSE PAISLEY,2,12/1/10 17:06,4.21,,United Kingdom
536592,22278,OVERNIGHT BAG VINTAGE ROSE PAISLEY,1,12/1/10 17:06,11.02,,United Kingdom
536592,22283,6 EGG HOUSE PAINTED WOOD,1,12/1/10 17:06,16.13,,United Kingdom
536592,22294,HEART FILIGREE DOVE  SMALL,3,12/1/10 17:06,2.51,,United Kingdom
536592,22300,COFFEE MUG DOG + BALL DESIGN,2,12/1/10 17:06,5.06,,United Kingdom
536592,22301,COFFEE MUG CAT + BIRD DESIGN,2,12/1/10 17:06,5.06,,United Kingdom
536592,22304,COFFEE MUG BLUE PAISLEY DESIGN,1,12/1/10 17:06,5.06,,United Kingdom
536592,22308,TEA COSY BLUE STRIPE,1,12/1/10 17:06,5.06,,United Kingdom
536592,22309,TEA COSY RED  STRIPE,1,12/1/10 17:06,5.06,,United Kingdom
536592,22310,IVORY KNITTED MUG COSY ,1,12/1/10 17:06,3.36,,United Kingdom
536592,22311,OFFICE MUG WARMER BLACK+SILVER ,2,12/1/10 17:06,5.91,,United Kingdom
536592,22312,OFFICE MUG WARMER POLKADOT,1,12/1/10 17:06,5.91,,United Kingdom
536592,22314,OFFICE MUG WARMER CHOC+BLUE,1,12/1/10 17:06,5.91,,United Kingdom
536592,22317,FIVE CATS HANGING DECORATION,2,12/1/10 17:06,5.91,,United Kingdom
536592,22324,BLUE POLKADOT KIDS BAG,1,12/1/10 17:06,4.21,,United Kingdom
536592,22325,MOBILE VINTAGE HEARTS ,1,12/1/10 17:06,11.87,,United Kingdom
536592,22331,WOODLAND PARTY BAG + STICKER SET,1,12/1/10 17:06,3.36,,United Kingdom
536592,22342,HOME GARLAND PAINTED ZINC ,1,12/1/10 17:06,3.36,,United Kingdom
536592,22348,TEA BAG PLATE RED RETROSPOT,2,12/1/10 17:06,1.66,,United Kingdom
536592,22350,ILLUSTRATED CAT BOWL ,2,12/1/10 17:06,5.06,,United Kingdom
536592,22352,LUNCH BOX WITH CUTLERY RETROSPOT ,1,12/1/10 17:06,5.06,,United Kingdom
536592,22355,CHARLOTTE BAG SUKI DESIGN,2,12/1/10 17:06,1.66,,United Kingdom
536592,22356,CHARLOTTE BAG PINK POLKADOT,6,12/1/10 17:06,1.66,,United Kingdom
536592,22364,GLASS JAR DIGESTIVE BISCUITS,1,12/1/10 17:06,5.91,,United Kingdom
536592,22371,AIRLINE BAG VINTAGE TOKYO 78,3,12/1/10 17:06,8.47,,United Kingdom
536592,22376,AIRLINE BAG VINTAGE JET SET WHITE,2,12/1/10 17:06,8.47,,United Kingdom
536592,22379,RECYCLING BAG RETROSPOT ,2,12/1/10 17:06,4.21,,United Kingdom
536592,22381,TOY TIDY PINK POLKADOT,1,12/1/10 17:06,4.21,,United Kingdom
536592,22386,JUMBO BAG PINK POLKADOT,3,12/1/10 17:06,4.21,,United Kingdom
536592,22393,PAPERWEIGHT VINTAGE COLLAGE,1,12/1/10 17:06,5.06,,United Kingdom
536592,22396,MAGNETS PACK OF 4 RETRO PHOTO,1,12/1/10 17:06,2.51,,United Kingdom
536592,22405,MONEY BOX POCKET MONEY DESIGN,1,12/1/10 17:06,2.51,,United Kingdom
536592,22409,MONEY BOX BISCUITS DESIGN,1,12/1/10 17:06,2.51,,United Kingdom
536592,22411,JUMBO SHOPPER VINTAGE RED PAISLEY,2,12/1/10 17:06,4.21,,United Kingdom
536592,22413,METAL SIGN TAKE IT OR LEAVE IT ,1,12/1/10 17:06,5.91,,United Kingdom
536592,22419,LIPSTICK PEN RED,7,12/1/10 17:06,0.85,,United Kingdom
536592,22420,LIPSTICK PEN BABY PINK,2,12/1/10 17:06,0.85,,United Kingdom
536592,22421,LIPSTICK PEN FUSCHIA,3,12/1/10 17:06,0.85,,United Kingdom
536592,22422,TOOTHPASTE TUBE PEN,2,12/1/10 17:06,1.28,,United Kingdom
536592,22423,REGENCY CAKESTAND 3 TIER,47,12/1/10 17:06,12.72,,United Kingdom
536592,22425,ENAMEL COLANDER CREAM,1,12/1/10 17:06,10.17,,United Kingdom
536592,22427,ENAMEL FLOWER JUG CREAM,1,12/1/10 17:06,11.87,,United Kingdom
536592,22428,ENAMEL FIRE BUCKET CREAM,1,12/1/10 17:06,14.43,,United Kingdom
536592,22449,SILK PURSE BABUSHKA PINK,1,12/1/10 17:06,6.77,,United Kingdom
536592,22451,SILK PURSE BABUSHKA RED,1,12/1/10 17:06,6.77,,United Kingdom
536592,22458,CAST IRON HOOK GARDEN FORK,1,12/1/10 17:06,5.06,,United Kingdom
536592,22459,CAST IRON HOOK GARDEN TROWEL,1,12/1/10 17:06,5.06,,United Kingdom
536592,22467,GUMBALL COAT RACK,1,12/1/10 17:06,5.06,,United Kingdom
536592,22469,HEART OF WICKER SMALL,11,12/1/10 17:06,3.36,,United Kingdom
536592,22472,TV DINNER TRAY DOLLY GIRL,3,12/1/10 17:06,11.02,,United Kingdom
536592,22487,WHITE WOOD GARDEN PLANT LADDER,1,12/1/10 17:06,20.38,,United Kingdom
536592,22489,PACK OF 12 TRADITIONAL CRAYONS,2,12/1/10 17:06,0.85,,United Kingdom
536592,22499,WOODEN UNION JACK BUNTING,1,12/1/10 17:06,12.72,,United Kingdom
536592,22501,PICNIC BASKET WICKER LARGE,2,12/1/10 17:06,21.23,,United Kingdom
536592,22503,CABIN BAG VINTAGE PAISLEY,1,12/1/10 17:06,59.53,,United Kingdom
536592,22508,DOORSTOP RETROSPOT HEART,2,12/1/10 17:06,7.62,,United Kingdom
536592,22530,MAGIC DRAWING SLATE DOLLY GIRL ,3,12/1/10 17:06,0.85,,United Kingdom
536592,22531,MAGIC DRAWING SLATE CIRCUS PARADE  ,1,12/1/10 17:06,0.85,,United Kingdom
536592,22534,MAGIC DRAWING SLATE SPACEBOY ,1,12/1/10 17:06,0.85,,United Kingdom
536592,22536,MAGIC DRAWING SLATE PURDEY,1,12/1/10 17:06,0.85,,United Kingdom
536592,22537,MAGIC DRAWING SLATE DINOSAUR,1,12/1/10 17:06,0.85,,United Kingdom
536592,22539,MINI JIGSAW DOLLY GIRL,1,12/1/10 17:06,0.85,,United Kingdom
536592,22544,MINI JIGSAW SPACEBOY,1,12/1/10 17:06,0.85,,United Kingdom
536592,22547,MINI JIGSAW DINOSAUR ,1,12/1/10 17:06,0.85,,United Kingdom
536592,22553,PLASTERS IN TIN SKULLS,1,12/1/10 17:06,3.36,,United Kingdom
536592,22557,PLASTERS IN TIN VINTAGE PAISLEY ,1,12/1/10 17:06,3.36,,United Kingdom
536592,22560,TRADITIONAL MODELLING CLAY,1,12/1/10 17:06,2.51,,United Kingdom
536592,22561,WOODEN SCHOOL COLOURING SET,1,12/1/10 17:06,3.36,,United Kingdom
536592,22565,FELTCRAFT HAIRBANDS PINK AND WHITE ,1,12/1/10 17:06,1.66,,United Kingdom
536592,22566,FELTCRAFT HAIRBAND PINK AND PURPLE,1,12/1/10 17:06,1.66,,United Kingdom
536592,22569,FELTCRAFT CUSHION BUTTERFLY,2,12/1/10 17:06,7.62,,United Kingdom
536592,22570,FELTCRAFT CUSHION RABBIT,1,12/1/10 17:06,7.62,,United Kingdom
536592,22571,ROCKING HORSE RED CHRISTMAS ,1,12/1/10 17:06,1.66,,United Kingdom
536592,22580,ADVENT CALENDAR GINGHAM SACK,1,12/1/10 17:06,11.87,,United Kingdom
536592,22581,WOOD STOCKING CHRISTMAS SCANDISPOT,1,12/1/10 17:06,1.66,,United Kingdom
536592,22582,PACK OF 6 SWEETIE GIFT BOXES,2,12/1/10 17:06,5.06,,United Kingdom
536592,22583,PACK OF 6 HANDBAG GIFT BOXES,1,12/1/10 17:06,5.06,,United Kingdom
536592,22584,PACK OF 6 PANNETONE GIFT BOXES,1,12/1/10 17:06,5.06,,United Kingdom
536592,22586,FELTCRAFT HAIRBAND PINK AND BLUE,1,12/1/10 17:06,1.66,,United Kingdom
536592,22587,FELTCRAFT HAIRBAND RED AND BLUE,2,12/1/10 17:06,1.66,,United Kingdom
536592,22588,CARD HOLDER GINGHAM HEART,5,12/1/10 17:06,5.06,,United Kingdom
536592,22589,CARDHOLDER GINGHAM STAR,2,12/1/10 17:06,5.06,,United Kingdom
536592,22600,CHRISTMAS RETROSPOT STAR WOOD,2,12/1/10 17:06,1.66,,United Kingdom
536592,22601,CHRISTMAS RETROSPOT ANGEL WOOD,3,12/1/10 17:06,1.66,,United Kingdom
536592,22602,CHRISTMAS RETROSPOT HEART WOOD,1,12/1/10 17:06,1.66,,United Kingdom
536592,22603,CHRISTMAS RETROSPOT TREE WOOD,1,12/1/10 17:06,1.66,,United Kingdom
536592,22619,SET OF 6 SOLDIER SKITTLES,1,12/1/10 17:06,7.62,,United Kingdom
536592,22620,4 TRADITIONAL SPINNING TOPS,2,12/1/10 17:06,2.51,,United Kingdom
536592,22622,BOX OF VINTAGE ALPHABET BLOCKS,1,12/1/10 17:06,21.23,,United Kingdom
536592,22624,IVORY KITCHEN SCALES,1,12/1/10 17:06,16.98,,United Kingdom
536592,22625,RED KITCHEN SCALES,1,12/1/10 17:06,16.98,,United Kingdom
536592,22631,CIRCUS PARADE LUNCH BOX ,1,12/1/10 17:06,4.21,,United Kingdom
536592,22632,HAND WARMER RED RETROSPOT,1,12/1/10 17:06,4.21,,United Kingdom
536592,22637,PIGGY BANK RETROSPOT ,1,12/1/10 17:06,5.06,,United Kingdom
536592,22645,CERAMIC HEART FAIRY CAKE MONEY BANK,1,12/1/10 17:06,3.36,,United Kingdom
536592,22649,STRAWBERRY FAIRY CAKE TEAPOT,2,12/1/10 17:06,11.02,,United Kingdom
536592,22651,GENTLEMAN SHIRT REPAIR KIT ,1,12/1/10 17:06,1.66,,United Kingdom
536592,22659,LUNCH BOX I LOVE LONDON,1,12/1/10 17:06,4.21,,United Kingdom
536592,22663,JUMBO BAG DOLLY GIRL DESIGN,3,12/1/10 17:06,4.21,,United Kingdom
536592,22664,TOY TIDY DOLLY GIRL DESIGN,3,12/1/10 17:06,4.21,,United Kingdom
536592,22665,RECIPE BOX BLUE SKETCHBOOK DESIGN,1,12/1/10 17:06,5.91,,United Kingdom
536592,22666,RECIPE BOX PANTRY YELLOW DESIGN,1,12/1/10 17:06,5.91,,United Kingdom
536592,22668,PINK BABY BUNTING,1,12/1/10 17:06,5.91,,United Kingdom
536592,22669,RED BABY BUNTING ,3,12/1/10 17:06,5.91,,United Kingdom
536592,22673,FRENCH GARDEN SIGN BLUE METAL,1,12/1/10 17:06,2.51,,United Kingdom
536592,22678,FRENCH BLUE METAL DOOR SIGN 3,1,12/1/10 17:06,2.51,,United Kingdom
536592,22692,DOORMAT WELCOME TO OUR HOME,1,12/1/10 17:06,7.95,,United Kingdom
536592,22694,WICKER STAR ,1,12/1/10 17:06,4.21,,United Kingdom
536592,22696,WICKER WREATH LARGE,1,12/1/10 17:06,4.21,,United Kingdom
536592,22697,GREEN REGENCY TEACUP AND SAUCER,3,12/1/10 17:06,5.91,,United Kingdom
536592,22699,ROSES REGENCY TEACUP AND SAUCER ,4,12/1/10 17:06,5.91,,United Kingdom
536592,22712,CARD DOLLY GIRL ,1,12/1/10 17:06,0.85,,United Kingdom
536592,22713,CARD I LOVE LONDON ,4,12/1/10 17:06,0.85,,United Kingdom
536592,22726,ALARM CLOCK BAKELIKE GREEN,2,12/1/10 17:06,7.62,,United Kingdom
536592,22734,SET OF 6 RIBBONS VINTAGE CHRISTMAS,1,12/1/10 17:06,5.06,,United Kingdom
536592,22735,RIBBON REEL SOCKS AND MITTENS,3,12/1/10 17:06,3.36,,United Kingdom
536592,22737,RIBBON REEL CHRISTMAS PRESENT ,2,12/1/10 17:06,3.36,,United Kingdom
536592,22738,RIBBON REEL SNOWY VILLAGE,1,12/1/10 17:06,3.36,,United Kingdom
536592,22739,RIBBON REEL CHRISTMAS SOCK BAUBLE,7,12/1/10 17:06,3.36,,United Kingdom
536592,22741,FUNKY DIVA PEN,3,12/1/10 17:06,1.66,,United Kingdom
536592,22742,MAKE YOUR OWN PLAYTIME CARD KIT,1,12/1/10 17:06,5.91,,United Kingdom
536592,22745,POPPY'S PLAYHOUSE BEDROOM ,1,12/1/10 17:06,4.21,,United Kingdom
536592,22746,POPPY'S PLAYHOUSE LIVINGROOM ,2,12/1/10 17:06,4.21,,United Kingdom
536592,22747,POPPY'S PLAYHOUSE BATHROOM,1,12/1/10 17:06,4.21,,United Kingdom
536592,22748,POPPY'S PLAYHOUSE KITCHEN,1,12/1/10 17:06,4.21,,United Kingdom
536592,22749,FELTCRAFT PRINCESS CHARLOTTE DOLL,2,12/1/10 17:06,7.62,,United Kingdom
536592,22751,FELTCRAFT PRINCESS OLIVIA DOLL,1,12/1/10 17:06,7.62,,United Kingdom
536592,22754,SMALL RED BABUSHKA NOTEBOOK ,2,12/1/10 17:06,1.66,,United Kingdom
536592,22756,LARGE YELLOW BABUSHKA NOTEBOOK ,1,12/1/10 17:06,2.51,,United Kingdom
536592,22758,LARGE PURPLE BABUSHKA NOTEBOOK  ,2,12/1/10 17:06,2.51,,United Kingdom
536592,22759,SET OF 3 NOTEBOOKS IN PARCEL,5,12/1/10 17:06,3.36,,United Kingdom
536592,22775,PURPLE DRAWERKNOB ACRYLIC EDWARDIAN,3,12/1/10 17:06,2.51,,United Kingdom
536592,22781,GUMBALL MAGAZINE RACK,1,12/1/10 17:06,15.28,,United Kingdom
536592,22788,BROCANTE COAT RACK,1,12/1/10 17:06,20.38,,United Kingdom
536592,22791,T-LIGHT GLASS FLUTED ANTIQUE,4,12/1/10 17:06,2.51,,United Kingdom
536592,22792,FLUTED ANTIQUE CANDLE HOLDER,4,12/1/10 17:06,1.66,,United Kingdom
536592,22794,SWEETHEART WIRE MAGAZINE RACK,1,12/1/10 17:06,16.13,,United Kingdom
536592,22795,SWEETHEART RECIPE BOOK STAND,3,12/1/10 17:06,13.57,,United Kingdom
536592,22798,ANTIQUE GLASS DRESSING TABLE POT,2,12/1/10 17:06,5.91,,United Kingdom
536592,22800,ANTIQUE TALL SWIRLGLASS TRINKET POT,2,12/1/10 17:06,7.62,,United Kingdom
536592,22801,ANTIQUE GLASS PEDESTAL BOWL,2,12/1/10 17:06,7.62,,United Kingdom
536592,22805,BLUE DRAWER KNOB ACRYLIC EDWARDIAN,4,12/1/10 17:06,2.51,,United Kingdom
536592,22810,SET OF 6 T-LIGHTS SNOWMEN,1,12/1/10 17:06,5.91,,United Kingdom
536592,22812,PACK 3 BOXES CHRISTMAS PANNETONE,3,12/1/10 17:06,4.21,,United Kingdom
536592,22813,PACK 3 BOXES BIRD PANNETONE ,2,12/1/10 17:06,4.21,,United Kingdom
536592,22814,CARD PARTY GAMES ,5,12/1/10 17:06,0.85,,United Kingdom
536592,22831,WHITE BROCANTE SOAP DISH,1,12/1/10 17:06,5.91,,United Kingdom
536592,22834,HAND WARMER BABUSHKA DESIGN,3,12/1/10 17:06,4.21,,United Kingdom
536592,22835,HOT WATER BOTTLE I AM SO POORLY,5,12/1/10 17:06,9.32,,United Kingdom
